{
  "$schema": "https://json-schema.org/draft/2020-12/schema",
  "title": "metadata.json",
  "description": "Run metadata: timestamp, Cell_Size, every Device_Config key used, deduplicated citations, gap summary, and the factor legend (Req 3.4). See docs/schema.md.",
  "type": "object",
  "required": [
    "schema_version",
    "run_timestamp_utc",
    "cell_size_mi",
    "device_config",
    "citations",
    "gap_summary",
    "factors",
    "tier3_notice",
    "disclaimer",
    "known_limitations"
  ],
  "additionalProperties": false,
  "properties": {
    "schema_version": { "const": "1.0" },
    "run_timestamp_utc": {
      "type": "string",
      "pattern": "^\\d{4}-\\d{2}-\\d{2}T\\d{2}:\\d{2}:\\d{2}(\\.\\d+)?Z$"
    },
    "cell_size_mi": { "type": "number", "minimum": 0.25, "maximum": 5 },
    "device_config": {
      "type": "object",
      "minProperties": 1,
      "additionalProperties": { "$ref": "#/$defs/ConfigEntry" }
    },
    "citations": {
      "type": "array",
      "minItems": 1,
      "items": { "$ref": "#/$defs/Citation" }
    },
    "gap_summary": {
      "type": "object",
      "additionalProperties": { "type": "integer", "minimum": 0 }
    },
    "factors": {
      "type": "array",
      "items": { "$ref": "#/$defs/FactorLegendEntry" }
    },
    "tier3_notice": { "type": "string", "minLength": 1 },
    "disclaimer": { "const": "Not legal advice" },
    "known_limitations": {
      "type": "array",
      "items": { "type": "string", "minLength": 1 }
    }
  },
  "$defs": {
    "ConfigEntry": {
      "type": "object",
      "required": ["value", "unit"],
      "additionalProperties": false,
      "properties": {
        "value": { "type": ["number", "string", "boolean", "array", "object", "null"] },
        "unit": { "type": ["string", "null"] }
      }
    },
    "Citation": {
      "type": "object",
      "required": ["id", "agency", "dataset", "endpoint", "date", "date_kind"],
      "additionalProperties": false,
      "properties": {
        "id": { "type": "string", "minLength": 1 },
        "agency": { "type": "string", "minLength": 1 },
        "dataset": { "type": "string", "minLength": 1 },
        "endpoint": { "type": "string", "minLength": 1 },
        "date": { "type": "string", "pattern": "^\\d{4}-\\d{2}-\\d{2}$" },
        "date_kind": { "enum": ["model_run", "fetch"] },
        "note": { "type": "string" }
      }
    },
    "Tags": {
      "description": "Exactly one primary tag (QUANTIFIED DATA or PROXY), optionally plus EXTERNAL ADDITION.",
      "type": "array",
      "minItems": 1,
      "maxItems": 2,
      "uniqueItems": true,
      "items": { "enum": ["QUANTIFIED DATA", "PROXY", "EXTERNAL ADDITION"] },
      "contains": { "enum": ["QUANTIFIED DATA", "PROXY"] },
      "minContains": 1,
      "maxContains": 1
    },
    "FactorKey": {
      "enum": [
        "velocity_peak",
        "velocity_source_period",
        "power_density",
        "depth",
        "qualifying_area",
        "cf_stream",
        "energy_stream_kwh",
        "tidal_range",
        "coops_station",
        "energy_cycle_j",
        "cf_rise_fall",
        "energy_rise_fall_kwh",
        "wave_power",
        "wave_hs_mean",
        "dist_transmission_km",
        "dist_substation_km",
        "utility",
        "vessel_traffic",
        "fishing_activity",
        "diadromous_fish_km",
        "whale_critical_habitat",
        "slope_deg",
        "port_km",
        "price_usd_kwh",
        "gross_usd",
        "m_transport",
        "m_transmission",
        "m_maint",
        "net_usd"
      ]
    },
    "FactorLegendEntry": {
      "type": "object",
      "required": ["name", "tags", "citation_id", "unit"],
      "additionalProperties": false,
      "properties": {
        "name": { "$ref": "#/$defs/FactorKey" },
        "tags": { "$ref": "#/$defs/Tags" },
        "citation_id": { "type": "string", "minLength": 1 },
        "unit": { "type": ["string", "null"] },
        "label": { "type": "string" }
      }
    }
  }
}
